Company,Title,About,Total_Images_Found,Images_Blocked_or_Skipped
Infosys,Infosys - Consulting | IT Services | Digital Transformation,Being Resilient. That's Live Enterprise. Digital Core Capabilities Digital Operating Model,56,16
Wipro,Wipro | Consulting-Led and AI-Powered Technology Services & Consulting Company,  ,40,10
TechMahindra,Tech Mahindra | Scale at Speed,AI Delivered Right Scale at Speed™ Store of the Future: Research Report,57,8
HCLTech,"HCLTech: Supercharging Progress | Digital, Engineering and Cloud",Search SearchClose Search,46,1
LNT,"L&T Corporate | EPC, Hi-Tech Manufacturing, Services","L&T leads in nearly every sphere of business it operates in. Serving customers in more than 50 countries, across various industries. Explore our offerings by Industry or by Business. L&T leads in nearly every sphere of business it operates in. Serving customers in more than 50 countries, across various industries. Explore our offerings by Industry or by Business. Raising the bar to the next level, L&T is undertaking big goals related to Climate Change and Water Security. We aim to achieve Carbon Neutrality by 2040, ahead of the Paris Agreement deadline of 2050, and Water Neutrality by 2035.",88,2
